source_id,source_type,source_url,date,candidate_relation,evidence_text,trigger_phrase,extraction_method,num_entities_in_sentence,entity_a,entity_b
287,PUBMED,https://pubmed.ncbi.nlm.nih.gov/25470694/,Dec-14,CO_OCCURS_WITH,Crizotinib was superior to standard first-line pemetrexed-plus-platinum chemotherapy in patients with previously untreated advanced ALK-positive NSCLC.,soft_relation_context,sentence_cooccurrence_fallback_relaxed,2,ALK,NSCLC
287,PUBMED,https://pubmed.ncbi.nlm.nih.gov/25470694/,Dec-14,CO_OCCURS_WITH,The efficacy of the ALK inhibitor crizotinib as compared with standard chemotherapy as first-line treatment for advanced ALK-positive non-small-cell lung cancer (NSCLC) is unknown.,soft_relation_context,sentence_cooccurrence_fallback_relaxed,2,ALK,NSCLC
287,PUBMED,https://pubmed.ncbi.nlm.nih.gov/25470694/,Dec-14,CO_OCCURS_WITH,"We conducted an open-label, phase 3 trial comparing crizotinib with chemotherapy in 343 patients with advanced ALK-positive nonsquamous NSCLC who had received no previous systemic treatment for advanced disease.",soft_relation_context,sentence_cooccurrence_fallback_relaxed,2,ALK,NSCLC
291,PUBMED,https://pubmed.ncbi.nlm.nih.gov/35081280/,Jan-22,CO_OCCURS_WITH,"During a median follow-up of 4.0 years, the incidences of MACE and cancer were higher with the combined tofacitinib doses (3.4% [98 patients] and 4.2% [122 patients], respectively) than with a TNF inhibitor (2.5% [37 patients] and 2.9% [42 patients]).",soft_relation_context,sentence_cooccurrence_fallback_relaxed,2,MACE,TNF
291,PUBMED,https://pubmed.ncbi.nlm.nih.gov/35081280/,Jan-22,CO_OCCURS_WITH,"In this trial comparing the combined tofacitinib doses with a TNF inhibitor in a cardiovascular risk-enriched population, risks of MACE and cancers were higher with tofacitinib and did not meet noninferiority criteria.",soft_relation_context,sentence_cooccurrence_fallback_relaxed,2,MACE,TNF
291,PUBMED,https://pubmed.ncbi.nlm.nih.gov/35081280/,Jan-22,CO_OCCURS_WITH,Increases in lipid levels and cancers with tofacitinib prompted a trial of major adverse cardiovascular events (MACE) and cancers in patients with rheumatoid arthritis receiving tofacitinib as compared with a tumor necrosis factor (TNF) inhibitor.,soft_relation_context,sentence_cooccurrence_fallback_relaxed,2,MACE,TNF
295,PUBMED,https://pubmed.ncbi.nlm.nih.gov/29949494/,Jun-18,FUNDED_WITH,"(Funded by Pfizer and Astellas Pharma; PROSPER ClinicalTrials.gov number, NCT02003924 .).","funded by pfizer and astellas pharma; prosper clinicaltrials.gov number, nct02003924",source_aware_sentence_trigger_relaxed,2,NCT02003924,PFIZER INC
296,PUBMED,https://pubmed.ncbi.nlm.nih.gov/40444708/,Jun-25,FUNDED_WITH,"(Funded by Pfizer and others; BREAKWATER ClinicalTrials.gov number, NCT04607421.).","funded by pfizer and others; breakwater clinicaltrials.gov number, nct04607421",source_aware_sentence_trigger_relaxed,2,BREAKWATER,PFIZER INC
301,PUBMED,https://pubmed.ncbi.nlm.nih.gov/36102184/,Nov-22,CO_OCCURS_WITH,"The Kabi/Pfizer International Growth Database (KIGS) is a large, international database (1987-2012) of children treated with recombinant human growth hormone (rhGH) in real-world settings.",soft_relation_context,sentence_cooccurrence_fallback_relaxed,2,KIGS,PFIZER INC
306,SEC,https://www.sec.gov/Archives/edgar/data/78003/000007800325000109/pfe-20250424.htm,Apr-25,CO_OCCURS_WITH,The nominees for election to the Company’s Board of Directors set forth in Item 1 to the Company’s Proxy Statement filed with the U.S.,soft_relation_context,sentence_cooccurrence_fallback_relaxed,2,the Company’s Board of Directors,the U.S. Securities and Exchange Commission
307,SEC,https://www.sec.gov/Archives/edgar/data/78003/000007800325000111/pfe-20250429.htm,Apr-25,CO_OCCURS_WITH,"(1) In addition, in connection with Pfizer’s efforts to simplify the structure and sharpen the focus of its research and development (“R&D”) organization, in the first quarter of 2025 Pfizer expanded the Program after having identified additional opportunities to drive improvements in productivity and operational efficiencies through enhanced digital enablement, including automation and AI, and simplification of business processes.",soft_relation_context,sentence_cooccurrence_fallback_relaxed,2,PFIZER INC,Program
307,SEC,https://www.sec.gov/Archives/edgar/data/78003/000007800325000111/pfe-20250429.htm,Apr-25,CO_OCCURS_WITH,"Pfizer may also incur other charges or cash expenditures not currently contemplated due to events that may occur as a result of, or associated with, the Program.",soft_relation_context,sentence_cooccurrence_fallback_relaxed,2,PFIZER INC,Program
307,SEC,https://www.sec.gov/Archives/edgar/data/78003/000007800325000111/pfe-20250429.htm,Apr-25,CO_OCCURS_WITH,"You should carefully consider the foregoing factors and the other risks and uncertainties that affect the business of Pfizer described in the “Risk Factors” and “Forward-Looking Information and Factors That May Affect Future Results” sections of its Annual Report on Form 10-K, Quarterly Reports on Form 10-Q and other documents filed by Pfizer from time to time with the U.S.",soft_relation_context,sentence_cooccurrence_fallback_relaxed,3,PFIZER INC,the “Risk Factors
307,SEC,https://www.sec.gov/Archives/edgar/data/78003/000007800325000111/pfe-20250429.htm,Apr-25,CO_OCCURS_WITH,"You should carefully consider the foregoing factors and the other risks and uncertainties that affect the business of Pfizer described in the “Risk Factors” and “Forward-Looking Information and Factors That May Affect Future Results” sections of its Annual Report on Form 10-K, Quarterly Reports on Form 10-Q and other documents filed by Pfizer from time to time with the U.S.",soft_relation_context,sentence_cooccurrence_fallback_relaxed,3,PFIZER INC,the U.S. Securities and Exchange Commission
307,SEC,https://www.sec.gov/Archives/edgar/data/78003/000007800325000111/pfe-20250429.htm,Apr-25,CO_OCCURS_WITH,"You should carefully consider the foregoing factors and the other risks and uncertainties that affect the business of Pfizer described in the “Risk Factors” and “Forward-Looking Information and Factors That May Affect Future Results” sections of its Annual Report on Form 10-K, Quarterly Reports on Form 10-Q and other documents filed by Pfizer from time to time with the U.S.",soft_relation_context,sentence_cooccurrence_fallback_relaxed,3,the U.S. Securities and Exchange Commission,the “Risk Factors
311,SEC,https://www.sec.gov/Archives/edgar/data/78003/000007800326000026/pfe-20251231.htm,Feb-26,CO_OCCURS_WITH,"Several manufacturers, including Pfizer, have signed voluntary agreements with the Trump Administration designed to ensure U.S.",soft_relation_context,sentence_cooccurrence_fallback_relaxed,2,PFIZER INC,the Trump Administration
312,SEC,https://www.sec.gov/Archives/edgar/data/78003/000119312525122480/d60311d8k.htm,May-25,CO_OCCURS_WITH,"1.2 Pricing Agreement, dated May 14, 2025, among Pfizer Netherlands International Finance B.V., Pfizer Inc.",soft_relation_context,sentence_cooccurrence_fallback_relaxed,2,Netherlands International Finance B.V.,PFIZER INC
312,SEC,https://www.sec.gov/Archives/edgar/data/78003/000119312525122480/d60311d8k.htm,May-25,CO_OCCURS_WITH,"Exhibit Description 1.1 Underwriting Agreement, dated May 14, 2025, among Pfizer Netherlands International Finance B.V., Pfizer Inc.",soft_relation_context,sentence_cooccurrence_fallback_relaxed,2,Netherlands International Finance B.V.,PFIZER INC
312,SEC,https://www.sec.gov/Archives/edgar/data/78003/000119312525122480/d60311d8k.htm,May-25,CO_OCCURS_WITH,"and the Issuer, originally filed with the Securities and Exchange Commission (the “Commission”) on February 23, 2024, as amended by the Post-Effective Amendment No.",soft_relation_context,sentence_cooccurrence_fallback_relaxed,2,Issuer,the Post-Effective Amendment No
314,SEC,https://www.sec.gov/Archives/edgar/data/78003/000007800325000159/pfe-20251113.htm,Nov-25,ACQUIRED,"(“Pfizer” or the “Company”) completed the previously announced acquisition of Metsera, Inc., a Delaware corporation (“Metsera”), pursuant to the Agreement and Plan of Merger, dated as of September 21, 2025, as amended by Amendment No.",acquisition of,source_aware_sentence_trigger_relaxed,2,"Metsera, Inc.",PFIZER INC
315,SEC,https://www.sec.gov/Archives/edgar/data/78003/000119312525291406/d80089d8k.htm,Nov-25,CO_OCCURS_WITH,"In connection with the offering of the Notes, the Company entered into an underwriting agreement (the “Underwriting Agreement”) and related pricing agreement (the “Pricing Agreement”), each dated November 18, 2025, with Citigroup Global Markets Inc., Deutsche Bank Securities Inc., J.P.",soft_relation_context,sentence_cooccurrence_fallback_relaxed,3,Citigroup Global Markets Inc.,Deutsche Bank Securities Inc.
315,SEC,https://www.sec.gov/Archives/edgar/data/78003/000119312525291406/d80089d8k.htm,Nov-25,CO_OCCURS_WITH,"In connection with the offering of the Notes, the Company entered into an underwriting agreement (the “Underwriting Agreement”) and related pricing agreement (the “Pricing Agreement”), each dated November 18, 2025, with Citigroup Global Markets Inc., Deutsche Bank Securities Inc., J.P.",soft_relation_context,sentence_cooccurrence_fallback_relaxed,3,Citigroup Global Markets Inc.,J.P. Morgan Securities
315,SEC,https://www.sec.gov/Archives/edgar/data/78003/000119312525291406/d80089d8k.htm,Nov-25,CO_OCCURS_WITH,"In connection with the offering of the Notes, the Company entered into an underwriting agreement (the “Underwriting Agreement”) and related pricing agreement (the “Pricing Agreement”), each dated November 18, 2025, with Citigroup Global Markets Inc., Deutsche Bank Securities Inc., J.P.",soft_relation_context,sentence_cooccurrence_fallback_relaxed,3,Deutsche Bank Securities Inc.,J.P. Morgan Securities
315,SEC,https://www.sec.gov/Archives/edgar/data/78003/000119312525291406/d80089d8k.htm,Nov-25,CO_OCCURS_WITH,"Morgan Securities LLC and Mizuho Securities USA LLC, as representatives of the several underwriters listed on Schedule I to the Pricing Agreement.",soft_relation_context,sentence_cooccurrence_fallback_relaxed,2,LLC,Mizuho Securities USA LLC
315,SEC,https://www.sec.gov/Archives/edgar/data/78003/000119312525291406/d80089d8k.htm,Nov-25,CO_OCCURS_WITH,"The Notes were issued pursuant to an indenture (the “Base Indenture”), dated as of September 7, 2018, between the Company and The Bank of New York Mellon, as trustee (the “Trustee”), as supplemented by the sixth supplemental indenture (the “Sixth Supplemental Indenture” and, the Base Indenture as supplemented by the Sixth Supplemental Indenture, the “Indenture”), dated as of November 21, 2025, between the Company and the Trustee.",soft_relation_context,sentence_cooccurrence_fallback_relaxed,3,The Bank of New York Mellon,Trustee
315,SEC,https://www.sec.gov/Archives/edgar/data/78003/000119312525291406/d80089d8k.htm,Nov-25,CO_OCCURS_WITH,"The Notes were issued pursuant to an indenture (the “Base Indenture”), dated as of September 7, 2018, between the Company and The Bank of New York Mellon, as trustee (the “Trustee”), as supplemented by the sixth supplemental indenture (the “Sixth Supplemental Indenture” and, the Base Indenture as supplemented by the Sixth Supplemental Indenture, the “Indenture”), dated as of November 21, 2025, between the Company and the Trustee.",soft_relation_context,sentence_cooccurrence_fallback_relaxed,3,The Bank of New York Mellon,the “Sixth Supplemental Indenture
315,SEC,https://www.sec.gov/Archives/edgar/data/78003/000119312525291406/d80089d8k.htm,Nov-25,CO_OCCURS_WITH,"The Notes were issued pursuant to an indenture (the “Base Indenture”), dated as of September 7, 2018, between the Company and The Bank of New York Mellon, as trustee (the “Trustee”), as supplemented by the sixth supplemental indenture (the “Sixth Supplemental Indenture” and, the Base Indenture as supplemented by the Sixth Supplemental Indenture, the “Indenture”), dated as of November 21, 2025, between the Company and the Trustee.",soft_relation_context,sentence_cooccurrence_fallback_relaxed,3,Trustee,the “Sixth Supplemental Indenture
315,SEC,https://www.sec.gov/Archives/edgar/data/78003/000119312525291406/d80089d8k.htm,Nov-25,CO_OCCURS_WITH,"and Pfizer Netherlands International Finance B.V., originally filed with the Securities and Exchange Commission (the “Commission”) on February 23, 2024, as amended by the Post-Effective Amendment No.",soft_relation_context,sentence_cooccurrence_fallback_relaxed,3,Netherlands International Finance B.V.,PFIZER INC
315,SEC,https://www.sec.gov/Archives/edgar/data/78003/000119312525291406/d80089d8k.htm,Nov-25,CO_OCCURS_WITH,"and Pfizer Netherlands International Finance B.V., originally filed with the Securities and Exchange Commission (the “Commission”) on February 23, 2024, as amended by the Post-Effective Amendment No.",soft_relation_context,sentence_cooccurrence_fallback_relaxed,3,PFIZER INC,the Post-Effective Amendment No
315,SEC,https://www.sec.gov/Archives/edgar/data/78003/000119312525291406/d80089d8k.htm,Nov-25,CO_OCCURS_WITH,"and Pfizer Netherlands International Finance B.V., originally filed with the Securities and Exchange Commission (the “Commission”) on February 23, 2024, as amended by the Post-Effective Amendment No.",soft_relation_context,sentence_cooccurrence_fallback_relaxed,3,Netherlands International Finance B.V.,the Post-Effective Amendment No
558,PUBMED,https://pubmed.ncbi.nlm.nih.gov/30550791/,Dec-18,CO_OCCURS_WITH,Organoid-based propagation of primary tumor epithelium en bloc with endogenous immune stroma should enable immuno-oncology investigations within the TME and facilitate personalized immunotherapy testing.,soft_relation_context,sentence_cooccurrence_fallback_relaxed,2,Organoid,TME
560,PUBMED,https://pubmed.ncbi.nlm.nih.gov/33414681/,Dec-20,CO_OCCURS_WITH,"Here we compare two single-cell sequencing platforms: BD Rhapsody and 10x Genomics Chromium, including their different mechanisms and some scRNA-seq results obtained with them.",soft_relation_context,sentence_cooccurrence_fallback_relaxed,2,10X GENOMICS,BD Rhapsody
571,PUBMED,https://pubmed.ncbi.nlm.nih.gov/39250728/,Sep-24,CO_OCCURS_WITH,"It is compatible with established Python single cell and spatial transcriptomics software, and operates efficiently in a matter of minutes without requiring a GPU.",soft_relation_context,sentence_cooccurrence_fallback_relaxed,2,GPU,Python
571,PUBMED,https://pubmed.ncbi.nlm.nih.gov/39250728/,Sep-24,CO_OCCURS_WITH,Visium HD by 10X Genomics is the first commercially available platform capable of capturing full scale transcriptomic data paired with a reference morphology image from archived FFPE blocks at sub-cellular resolution.,soft_relation_context,sentence_cooccurrence_fallback_relaxed,2,10X GENOMICS,FFPE
577,SEC,https://www.sec.gov/Archives/edgar/data/1770787/000177078725000040/txg-20250603.htm,Jun-25,CO_OCCURS_WITH,"The final voting results were as follows: Votes For Votes Against Abstentions Broker Non-Votes 215,766,816 312,396 488,346 — Proposal 3 - Non-binding, Advisory Vote to Approve Executive Compensation of Named Executive Officers The Company’s stockholders approved, on a non-binding, advisory basis, the compensation of the Company’s named executive officers as described in more detail in the Company's definitive proxy statement filed with the U.S.",soft_relation_context,sentence_cooccurrence_fallback_relaxed,3,Advisory,Votes For Votes Against Abstentions Broker Non-Votes
577,SEC,https://www.sec.gov/Archives/edgar/data/1770787/000177078725000040/txg-20250603.htm,Jun-25,CO_OCCURS_WITH,"The final voting results were as follows: Votes For Votes Against Abstentions Broker Non-Votes 215,766,816 312,396 488,346 — Proposal 3 - Non-binding, Advisory Vote to Approve Executive Compensation of Named Executive Officers The Company’s stockholders approved, on a non-binding, advisory basis, the compensation of the Company’s named executive officers as described in more detail in the Company's definitive proxy statement filed with the U.S.",soft_relation_context,sentence_cooccurrence_fallback_relaxed,3,Votes For Votes Against Abstentions Broker Non-Votes,the U.S. Securities and Exchange Commission
577,SEC,https://www.sec.gov/Archives/edgar/data/1770787/000177078725000040/txg-20250603.htm,Jun-25,CO_OCCURS_WITH,"The final voting results were as follows: Votes For Votes Against Abstentions Broker Non-Votes 215,766,816 312,396 488,346 — Proposal 3 - Non-binding, Advisory Vote to Approve Executive Compensation of Named Executive Officers The Company’s stockholders approved, on a non-binding, advisory basis, the compensation of the Company’s named executive officers as described in more detail in the Company's definitive proxy statement filed with the U.S.",soft_relation_context,sentence_cooccurrence_fallback_relaxed,3,Advisory,the U.S. Securities and Exchange Commission
598,PUBMED,https://pubmed.ncbi.nlm.nih.gov/36170120/,Feb-23,CO_OCCURS_WITH,The objective of this report is to provide a summary of the clinical experience of different Hemophilia Treatment Centers in managing the switch to rVIII-SingleChain or rIX-FP in patients with hemophilia.,soft_relation_context,sentence_cooccurrence_fallback_relaxed,2,Hemophilia Treatment Centers,rIX-FP
600,PUBMED,https://pubmed.ncbi.nlm.nih.gov/39370961/,Feb-25,CO_OCCURS_WITH,"Adults and adolescents aged ≥12 years with HAE previously participating in phase 2 and pivotal phase 3 (VANGUARD) studies were rolled over to an OLE, alongside newly enrolled patients.",soft_relation_context,sentence_cooccurrence_fallback_relaxed,3,HAE,VANGUARD
600,PUBMED,https://pubmed.ncbi.nlm.nih.gov/39370961/,Feb-25,CO_OCCURS_WITH,"Adults and adolescents aged ≥12 years with HAE previously participating in phase 2 and pivotal phase 3 (VANGUARD) studies were rolled over to an OLE, alongside newly enrolled patients.",soft_relation_context,sentence_cooccurrence_fallback_relaxed,3,HAE,OLE
600,PUBMED,https://pubmed.ncbi.nlm.nih.gov/39370961/,Feb-25,CO_OCCURS_WITH,"Adults and adolescents aged ≥12 years with HAE previously participating in phase 2 and pivotal phase 3 (VANGUARD) studies were rolled over to an OLE, alongside newly enrolled patients.",soft_relation_context,sentence_cooccurrence_fallback_relaxed,3,OLE,VANGUARD
603,PUBMED,https://pubmed.ncbi.nlm.nih.gov/26026936/,Jul-15,CO_OCCURS_WITH,"The annual rate of lung density loss at TLC and FRC combined did not differ between groups (A1PI -1·50 g/L per year [SE 0·22]; placebo -2·12 g/L per year [0·24]; difference 0·62 g/L per year [95% CI -0·02 to 1·26], p=0·06).",soft_relation_context,sentence_cooccurrence_fallback_relaxed,2,FRC,TLC
606,PUBMED,https://pubmed.ncbi.nlm.nih.gov/40434599/,Jun-25,CO_OCCURS_WITH,A systematic literature review was conducted to identify randomized controlled trials (RCTs) investigating LTP treatments in patients (at least 12 years old) with HAE (PROSPERO protocol #CRD42022359207).,soft_relation_context,sentence_cooccurrence_fallback_relaxed,2,HAE,LTP
606,PUBMED,https://pubmed.ncbi.nlm.nih.gov/40434599/,Jun-25,CO_OCCURS_WITH,"In the absence of head-to-head comparative evidence, indirect comparison methods are needed to compare LTP treatments in patients with HAE.",soft_relation_context,sentence_cooccurrence_fallback_relaxed,2,HAE,LTP
606,PUBMED,https://pubmed.ncbi.nlm.nih.gov/40434599/,Jun-25,CO_OCCURS_WITH,"The objective of this analysis was to estimate the comparative efficacy, safety, and impact on quality of life of LTP treatments for patients with HAE through NMAs.",soft_relation_context,sentence_cooccurrence_fallback_relaxed,2,HAE,LTP
607,PUBMED,https://pubmed.ncbi.nlm.nih.gov/36574241/,May-23,CO_OCCURS_WITH,Adult patients treated with VKA with an elevated INR (≥2.0 within 3 hours before study treatment) who received 4F-PCC or plasma after major bleeding or before an urgent surgery or invasive procedure were included in this retrospective analysis of data from 2 prospective phase 3b randomized controlled trials.,soft_relation_context,sentence_cooccurrence_fallback_relaxed,2,INR,VKA
607,PUBMED,https://pubmed.ncbi.nlm.nih.gov/36574241/,May-23,CO_OCCURS_WITH,"However, the relationship between corrected INR and vitamin K-dependent factor (VKDF) levels for hemostasis is uncertain.",soft_relation_context,sentence_cooccurrence_fallback_relaxed,2,INR,VKDF
607,PUBMED,https://pubmed.ncbi.nlm.nih.gov/36574241/,May-23,CO_OCCURS_WITH,INR and vitamin K-dependent factor levels after vitamin K antagonist reversal with 4F-PCC or plasma.,soft_relation_context,sentence_cooccurrence_fallback_relaxed,2,4F-PCC,INR
607,PUBMED,https://pubmed.ncbi.nlm.nih.gov/36574241/,May-23,CO_OCCURS_WITH,"In the 4F-PCC group, 159 of 185 (85.9%) had an INR ≤1.5 at 30 minutes after the end of infusion compared with only 72 of 184 (39.1%) in the plasma group.",soft_relation_context,sentence_cooccurrence_fallback_relaxed,2,4F-PCC,INR
607,PUBMED,https://pubmed.ncbi.nlm.nih.gov/36574241/,May-23,CO_OCCURS_WITH,"This retrospective analysis demonstrated that treatment with 4F-PCC among patients treated with VKA rapidly restores VKDFs to hemostatic levels irrespective of the postinfusion INR value, whereas treatment with plasma does not.",soft_relation_context,sentence_cooccurrence_fallback_relaxed,3,4F-PCC,VKA
607,PUBMED,https://pubmed.ncbi.nlm.nih.gov/36574241/,May-23,CO_OCCURS_WITH,"This retrospective analysis demonstrated that treatment with 4F-PCC among patients treated with VKA rapidly restores VKDFs to hemostatic levels irrespective of the postinfusion INR value, whereas treatment with plasma does not.",soft_relation_context,sentence_cooccurrence_fallback_relaxed,3,4F-PCC,INR
607,PUBMED,https://pubmed.ncbi.nlm.nih.gov/36574241/,May-23,CO_OCCURS_WITH,"This retrospective analysis demonstrated that treatment with 4F-PCC among patients treated with VKA rapidly restores VKDFs to hemostatic levels irrespective of the postinfusion INR value, whereas treatment with plasma does not.",soft_relation_context,sentence_cooccurrence_fallback_relaxed,3,INR,VKA
607,PUBMED,https://pubmed.ncbi.nlm.nih.gov/36574241/,May-23,CO_OCCURS_WITH,We aim to examine the impact of 4-factor prothrombin complex concentrate (4F-PCC) or plasma on INR correction and VKDF restoration and evaluate the relationship between INR values and VKDF levels in patients with acute major bleeding or patients requiring an urgent surgical procedure.,soft_relation_context,sentence_cooccurrence_fallback_relaxed,2,INR,VKDF
609,PUBMED,https://pubmed.ncbi.nlm.nih.gov/40380363/,May-25,CO_OCCURS_WITH,AE-QoL and TSQM II scores were evaluated in comparison with minimal clinically important differences (MCID).,soft_relation_context,sentence_cooccurrence_fallback_relaxed,2,AE-QoL,MCID
609,PUBMED,https://pubmed.ncbi.nlm.nih.gov/40380363/,May-25,CO_OCCURS_WITH,Methods: Patients ages ≥12 years and with HAE received garadacimab 200 mg subcutaneously once monthly in the OLE study.,soft_relation_context,sentence_cooccurrence_fallback_relaxed,2,HAE,OLE
609,PUBMED,https://pubmed.ncbi.nlm.nih.gov/40380363/,May-25,CO_OCCURS_WITH,The AE-QoL MCID was met by 92.1% of patients who were garadacimab naive; 81.6% of patients with previous garadacimab exposure experienced stable AE-QoL scores or further improvements per MCID.,soft_relation_context,sentence_cooccurrence_fallback_relaxed,2,AE-QoL,MCID
615,PUBMED,https://pubmed.ncbi.nlm.nih.gov/37097356/,Apr-23,CO_OCCURS_WITH,"New-user cohort studies with propensity score matching using 3 US claims databases (Optum Clinformatics, MarketScan, and Medicare).",soft_relation_context,sentence_cooccurrence_fallback_relaxed,2,Medicare,Optum Clinformatics
620,PUBMED,https://pubmed.ncbi.nlm.nih.gov/38246194/,Feb-24,COLLABORATED_WITH,"Moderna in collaboration with Merck Sharp & Dohme, a subsidiary of Merck & Co, Rahway, NJ, USA.",in collaboration with,source_aware_sentence_trigger_relaxed,3,Merck,Moderna
620,PUBMED,https://pubmed.ncbi.nlm.nih.gov/38246194/,Feb-24,COLLABORATED_WITH,"Moderna in collaboration with Merck Sharp & Dohme, a subsidiary of Merck & Co, Rahway, NJ, USA.",in collaboration with,source_aware_sentence_trigger_relaxed,3,Moderna,Sharp & Dohme
620,PUBMED,https://pubmed.ncbi.nlm.nih.gov/38246194/,Feb-24,COLLABORATED_WITH,"Moderna in collaboration with Merck Sharp & Dohme, a subsidiary of Merck & Co, Rahway, NJ, USA.",in collaboration with,source_aware_sentence_trigger_relaxed,3,Merck,Sharp & Dohme
628,PUBMED,https://pubmed.ncbi.nlm.nih.gov/38811605/,May-24,CO_OCCURS_WITH,"Variants of the GII.4 genotype are typically the most common genotype, and other genotypes cause varying amounts of disease year-to-year, with GII.2, GII.3, and GII.6 most prevalent in recent years.",soft_relation_context,sentence_cooccurrence_fallback_relaxed,2,GII.2,GII.3
629,PUBMED,https://pubmed.ncbi.nlm.nih.gov/38889247/,Nov-24,CO_OCCURS_WITH,The mRNA-1345 vaccine demonstrated efficacy against respiratory syncytial virus (RSV) disease with acceptable safety in adults aged ≥60 years in the ConquerRSV trial.,soft_relation_context,sentence_cooccurrence_fallback_relaxed,2,ConquerRSV,RSV
629,PUBMED,https://pubmed.ncbi.nlm.nih.gov/38889247/,Nov-24,CO_OCCURS_WITH,"mRNA-1345 enhanced RSV-A and RSV-B nAbs and preF bAbs in adults (≥60 years) across various subgroups, including those at risk for severe disease, consistent with its demonstrated efficacy in the prevention of RSV disease.",soft_relation_context,sentence_cooccurrence_fallback_relaxed,3,RSV,nAbs
