source_id,source_type,raw_text,source_url,date,company_seed
60,SEC,"10x Genomics, Inc. 10-K Extracted item 1A Item 1A. Risk Factors. Investing in our Class A common stock involves a high degree of risk. You should carefully consider the risks described below, as well as the other information in this Annual Report, including our financial statements and the related notes and the section titled &#8220;Management&#8217;s Discussion and Analysis of Financial Condition and Results of Operations&#8221; in this Annual Report, before deciding whether to invest in our Class A common stock. The occurrence of any of the events or developments described below could harm our business, financial condition, results of operations, cash flows and prospects. In such an event, the market price of our Class A common stock could decline and you may lose all or part of your investment. The risks and uncertainties described below are not the only ones we face. Additional risks and uncertainties not presently known to us or that we currently deem immaterial also may impair our business operations and the market price of our Class A common stock. In addition, you should consider the interrelationship and compounding effects of multiple risks occurring simultaneously. ##TABLE_START ##TABLE_END 12 Summary Risk Factors Our business is subject to a number of risks, including risks that may prevent us from achieving our business objectives or may adversely affect our business, financial condition, results of operations, cash flows and prospects. These risks are discussed more fully below and include, but are not limited to, risks related to: Risks related to our business and industry: &#8226; Fluctuations in our operating results due to a variety of factors; &#8226; Our dependency on the availability of government funding to and research and development spending by research institutions; &#8226; Our ability to compete effectively; &#8226; Our pricing strategy; &#8226; Existing, enhanced or new trade tariffs, import restrictions, export restrictions, Chinese regulations or other trade barriers; &#8226; Our ability to increase penetration into our existing customer segments and to maintain and increase the effectiveness of our commercial organization; &#8226; The size of the market for our solutions; &#8226; The complexity of data generated by our products; &#8226; Our ability to effectively manage product transitions and forecast customer demand, including for both existing and newly introduced products; &#8226; Our ability to generate sufficient revenue, to attain cash flows from operating activities in excess of our capital investment requirements and to achieve and maintain profitability; &#8226; Our ability to consistently manufacture our products to necessary specifications in necessary quantities and at acceptable cost and performance level; &#8226; Our ability to develop new products or new versions of existing products and enhance the capabilities of our existing products; &#8226; Our dependency on revenue generated from the sale of our Chromium solutions; &#8226; Doing business internationally, including in China and elsewhere in the Asia-Pacific region, and exposure to interest and foreign currency exchange rates; &#8226; The ability of suppliers to meet our needs and the needs of our customers; &#8226; The complexity of our operations and manufacturing our products, including in sourcing raw materials and preventing errors and defects in our solutions; &#8226; Our limited operating history, losses since inception, fluctuations in revenue and management of growth; and &#8226; The success of our products in achieving and sustaining scientific acceptance and generating revenue. Risks related to our regulatory environment and taxation: &#8226; Our products could become subject to more onerous government regulation; &#8226; Changes in tax laws or regulations that are applied adversely to us or our customers; and &#8226; Ethical, legal, privacy and social concerns or governmental restrictions surrounding the use of the genomic and multiomic information and gene editing. Risks related to our intellectual property, information technology and data security: &#8226; Our ability to obtain, maintain and protect our intellectual property rights; and &#8226; Our dependence on certain intellectual property rights that are licensed to us. Risks related to litigation and our intellectual property: &#8226; Our potential involvement in lawsuits in connection with intellectual property rights; and ##TABLE_START ##TABLE_END 13 &#8226; Our ability to effectively protect and enforce our intellectual property rights. Risks related to ownership of our Class A common stock: &#8226; The multi-class structure of our common stock; and &#8226; The requirement of our bylaws that the State of Delaware is the exclusive forum for substantially all disputes between us and our shareholders. General risks: &#8226; Our ability to meet our publicly announced guidance or other expectations about our business; and &#8226; The volatility of the market price of our Class A common stock. The summary risk factors described above should be read together with the text of the full risk factors below in this section titled &#8220; Risk Factors &#8221; and the other information set forth in this Annual Report on Form 10-K, including our consolidated financial statements and the related notes, as well as in other documents that we file with the SEC. The risks summarized above or described in full below are not the only risks that we face. Additional risks and uncertainties not precisely known to us or that we currently deem to be immaterial may also materially adversely affect our business, financial condition, results of operations and future prospects. Risks related to our business and industry Our operating results have in the past fluctuated significantly and may continue to fluctuate significantly in the future, which makes our future operating results difficult to predict and could cause our operating results to fall below expectations or any guidance we may provide. Our quarterly and annual operating results may fluctuate significantly, which makes it difficult for us to predict our future operating results. These fluctuations may occur due to a variety of factors, many of which are outside of our control, including, but not limited to: &#8226; delays in, changes in terms of, or reduction of governmental funding of life sciences research, generally, or of research projects which could utilize our solutions, specifically, or other changes that impact budgets, budget cycles or seasonal or other spending patterns of our customers, including potential freezes of, reductions in or reduced availability of National Institutes of Health (NIH) or other funding for our customers; &#8226; modifications to our commercial processes and organization, including changes we made to our commercial processes and organization to increase effectiveness; &#8226; the timing and magnitude of our price changes, including the effects of potentially lowering prices for certain of our products in 2025; &#8226; the effects of competition, including competition with both new and existing companies offering products that compete or intend to compete with our products and may offer performance, price or other advantages as well as researchers developing their own solutions; &#8226; enhanced trade tariffs, import restrictions, export restrictions, Chinese regulations or other trade barriers, including retaliatory measures taken by trade partners; &#8226; the effects of inflation on us or our customers, manufacturers and suppliers, including increases in the cost of labor and materials, including as a result of tariffs imposed by the United States which are currently, or in the future, under consideration, proposed or enacted; &#8226; excess capacity expenses and inventory write-downs; &#8226; fluctuations in demand for our products, which may vary significantly, our ability to accurately forecast demand, and our ability to increase penetration with our existing customers and to expand to new customers; &#8226; changes in general market conditions and other factors, including factors unrelated to our operating performance or the performance of our competitors; &#8226; changes in volume and product mix, particularly from products with lower gross margins than other products that we sell, or changes in costs related to our instruments and consumables, including products which incur royalty payment obligations at higher rates than other products we sell; ##TABLE_START ##TABLE_END 14 &#8226; the success of our recently introduced and recently announced products and new versions of existing products, and our ability to generate revenue for such products, and the introduction of new products or product enhancements by us or others in our industry including the timing of such introductions; &#8226; disruptions in customers&#8217; on-going experiments or interruptions in the ability of our customers to complete research projects; &#8226; investment decisions we make with respect to the allocation of our resources, including regarding product development or to support our commercial organization; &#8226; risks related to our business and demand for our products in China and elsewhere in the Asia-Pacific region, including competition or other factors; &#8226; differences in purchasing patterns across our customer base or across our two portfolios and variances in consumables spending for each of our portfolios; &#8226; higher than anticipated warranty costs; &#8226; the timing and amount of expenditures that we may incur to acquire, develop or commercialize additional products and technologies or for other purposes; &#8226; the timing and amount of expenditures (including success fees) related to litigation, as well as the outcomes of and related rulings in the litigation and administrative proceedings which may vary substantially from quarter to quarter; &#8226; the outcome of any current or future litigation or governmental investigations involving us or other third parties; &#8226; our ability and the ability of our partners to successfully manufacture our instruments and consumables in necessary quantities at necessary quality, including due to the impacts of supply chain disruptions, logistics, shipping and other distribution disruptions and labor shortages; &#8226; shortages, delays, production problems, distribution and quality issues with the materials we purchase for manufacturing, which could impact our ability to manufacture and ship our instruments, consumables and related components; &#8226; our inability or the inability of our customers to source our products or necessary equipment, components and materials used in our products or in conjunction with our products, including shortages of consumables or other components and materials used in gene sequencing (which occurred in 2024), because of issues with suppliers, including supply chain disruptions, logistics, shipping and other distribution disruptions and labor shortages; &#8226; our dependence and the dependence of our customers on single source and sole source suppliers for some of the equipment, components and materials used in our products or in conjunction with our products; &#8226; changes in customer payment timing trends including potential increases in the days sales outstanding (DSO); &#8226; expenses related to our facilities and real estate; &#8226; our ability to successfully integrate personnel, technology and other assets that we acquire into our company; &#8226; difficulties encountered by our commercial carriers in delivering our instruments or consumables, whether as a result of external factors such as weather, customs or import processes, transportation bottlenecks, port lockdowns or slowdowns or fuel shortages or internal issues such as labor disputes or difficulties hiring and retaining adequate staffing; &#8226; reductions in or other difficulties relat",https://www.sec.gov/Archives/edgar/data/1770787/000177078725000013/txg-20241231.htm,Feb-25,10X Genomics
61,PUBMED,"Efficacy and safety of garadacimab, a factor XIIa inhibitor for hereditary angioedema prevention (VANGUARD): a global, multicentre, randomised, double-blind, placebo-controlled, phase 3 trial. Hereditary angioedema is a rare and potentially life-threatening genetic disease that is associated with kallikrein-kinin system dysregulation. Garadacimab (CSL312), a novel, fully-human monoclonal antibody that inhibits activated factor XII (FXIIa), is being studied for the prevention of hereditary angioedema attacks. The aim of this study was to evaluate the efficacy and safety of once-monthly subcutaneous administrations of garadacimab as prophylaxis for hereditary angioedema. VANGUARD was a pivotal, multicentre, randomised, double-blind, placebo-controlled, phase 3 trial that recruited patients (aged ≥12 years) with type I or type II hereditary angioedema across seven countries (Canada, Germany, Hungary, Israel, Japan, the Netherlands, and the USA). Eligible patients were randomly assigned (3:2) to receive garadacimab or placebo for 6 months (182 days) by an interactive response technology (IRT) system. Randomisation was stratified by age (≤17 years vs >17 years) and baseline attack rate (1 to <3 attacks per month vs ≥3 attacks per month) for the adult group. The randomisation list and code were kept by the IRT provider during the study, with no access by site staff and funding representatives. All patients and investigational site staff, and representatives from the funder (or their delegates) with direct interaction with the study sites or patients, were masked to treatment assignment in a double-blind fashion. Randomly assigned patients received a 400-mg loading dose of subcutaneous garadacimab as two 200-mg injections or volume-matched placebo on day 1 of the treatment period, followed by five additional self-administered (or caregiver-administered) monthly doses of 200-mg subcutaneous garadacimab or volume-matched placebo. The primary endpoint was the investigator-assessed time-normalised number of hereditary angioedema attacks (number of hereditary angioedema attacks per month) during the 6-month treatment period (day 1 to day 182). Safety was evaluated in patients who received at least one dose of garadacimab or placebo. The study is registered with the EU Clinical Trials Register, 2020-000570-25 and ClinicalTrials.gov, NCT04656418. Between Jan 27, 2021, and June 7, 2022, we screened 80 patients, 76 of whom were eligible to enter the run-in period of the study. Of 65 eligible patients with type I or type II hereditary angioedema, 39 were randomly assigned to garadacimab and 26 to placebo. One patient was randomly assigned in error and did not enter the treatment period (no dose of study drug received), resulting in 39 patients assigned to garadacimab and 25 patients assigned to placebo being included. 38 (59%) of 64 participants were female and 26 (41%) were male. 55 (86%) of 64 participants were White, six (9%) were Asian (Japanese), one (2%) was Black or African American, one (2%) was Native Hawaiian or Other Pacific Islander, and one (2%) was listed as other. During the 6-month treatment period (day 1 to day 182), the mean number of investigator-confirmed hereditary angioedema attacks per month was significantly lower in the garadacimab group (0·27, 95% CI 0·05 to 0·49) than in the placebo group (2·01, 1·44 to 2·57; p<0·0001), corresponding to a percentage difference in means of -87% (95% CI -96 to -58; p<0·0001). The median number of hereditary angioedema attacks per month was 0 (IQR 0·00-0·31) for garadacimab and 1·35 (1·00-3·20) for placebo. The most common treatment-emergent adverse events were upper-respiratory tract infections, nasopharyngitis, and headaches. FXIIa inhibition was not associated with an increased risk of bleeding or thromboembolic events. Monthly garadacimab administration significantly reduced hereditary angioedema attacks in patients aged 12 years and older compared with placebo and had a favourable safety profile. Our results support the use of garadacimab as a potential prophylactic therapy for the treatment of hereditary angioedema in adolescents and adults. CSL Behring.",https://pubmed.ncbi.nlm.nih.gov/36868261/,Apr-23,CSL Behring
62,PUBMED,"Gene Therapy with Etranacogene Dezaparvovec for Hemophilia B. Moderate-to-severe hemophilia B is treated with lifelong, continuous coagulation factor IX replacement to prevent bleeding. Gene therapy for hemophilia B aims to establish sustained factor IX activity, thereby protecting against bleeding without burdensome factor IX replacement. In this open-label, phase 3 study, after a lead-in period (≥6 months) of factor IX prophylaxis, we administered one infusion of adeno-associated virus 5 (AAV5) vector expressing the Padua factor IX variant (etranacogene dezaparvovec; 2×1013 genome copies per kilogram of body weight) to 54 men with hemophilia B (factor IX activity ≤2% of the normal value) regardless of preexisting AAV5 neutralizing antibodies. The primary end point was the annualized bleeding rate, evaluated in a noninferiority analysis comparing the rate during months 7 through 18 after etranacogene dezaparvovec treatment with the rate during the lead-in period. Noninferiority of etranacogene dezaparvovec was defined as an upper limit of the two-sided 95% Wald confidence interval of the annualized bleeding rate ratio that was less than the noninferiority margin of 1.8. Superiority, additional efficacy measures, and safety were also assessed. The annualized bleeding rate decreased from 4.19 (95% confidence interval [CI], 3.22 to 5.45) during the lead-in period to 1.51 (95% CI, 0.81 to 2.82) during months 7 through 18 after treatment, for a rate ratio of 0.36 (95% Wald CI, 0.20 to 0.64; P<0.001), demonstrating noninferiority and superiority of etranacogene dezaparvovec as compared with factor IX prophylaxis. Factor IX activity had increased from baseline by a least-squares mean of 36.2 percentage points (95% CI, 31.4 to 41.0) at 6 months and 34.3 percentage points (95% CI, 29.5 to 39.1) at 18 months after treatment, and usage of factor IX concentrate decreased by a mean of 248,825 IU per year per participant in the post-treatment period (P<0.001 for all three comparisons). Benefits and safety were observed in participants with predose AAV5 neutralizing antibody titers of less than 700. No treatment-related serious adverse events occurred. Etranacogene dezaparvovec gene therapy was superior to prophylactic factor IX with respect to the annualized bleeding rate, and it had a favorable safety profile. (Funded by uniQure and CSL Behring; HOPE-B ClinicalTrials.gov number, NCT03569891.).",https://pubmed.ncbi.nlm.nih.gov/36812434/,Feb-23,CSL Behring
63,PUBMED,"Subcutaneous immunoglobulin for maintenance treatment in chronic inflammatory demyelinating polyneuropathy (PATH): a randomised, double-blind, placebo-controlled, phase 3 trial. Approximately two-thirds of patients with chronic inflammatory demyelinating polyneuropathy (CIDP) need long-term intravenous immunoglobulin. Subcutaneous immunoglobulin (SCIg) is an alternative option for immunoglobulin delivery, but has not previously been investigated in a large trial of CIDP. The PATH study compared relapse rates in patients given SCIg versus placebo. Between March 12, 2012, and Sept 20, 2016, we studied patients from 69 neuromuscular centres in North America, Europe, Israel, Australia, and Japan. Adults with definite or probable CIDP who responded to intravenous immunoglobulin treatment were eligible. We randomly allocated participants to 0·2 g/kg or 0·4 g/kg of a 20% SCIg solution (IgPro20) weekly versus placebo (2% human albumin solution) for maintenance treatment for 24 weeks. We did randomisation in a 1:1:1 ratio with an interactive voice and web response system with a block size of six, stratified by region (Japan or non-Japan). The primary outcome was the proportion of patients with a CIDP relapse or who were withdrawn for any other reason during 24 weeks of treatment. Patients, caregivers, and study personnel, including those assessing outcomes, were masked to treatment assignment. Analyses were done in the intention-to-treat and per-protocol sets. This trial is registered with ClinicalTrials.gov, number NCT01545076. In this randomised, double-blind, placebo-controlled trial, we randomly allocated 172 patients: 57 (33%) to the placebo group, 57 (33%) to the low-dose group, and 58 (34%) to the high-dose group. In the intention-to-treat set, 36 (63% [95% CI 50-74]) patients on placebo, 22 (39% [27-52]) on low-dose SCIg, and 19 (33% [22-46]) on high-dose SCIg had a relapse or were withdrawn from the study for other reasons (p=0·0007). Absolute risk reductions were 25% (95% CI 6-41) for low-dose versus placebo (p=0·007), 30% (12-46) for high-dose versus placebo (p=0·001), and 6% (-11 to 23) for high-dose versus low-dose (p=0·32). Causally related adverse events occurred in 47 (27%) patients (ten [18%] in the placebo group, 17 [30%] in the low-dose group, and 20 [34%] in the high-dose group). Six (3%) patients had 11 serious adverse events: one (2%) patient in the placebo group, three (5%) in the low-dose group, and two (3%) in the high-dose group; only one (an acute allergic skin reaction in the low-dose group) was assessed to be causally related. This study, which is to our knowledge, the largest trial of CIDP to date and the first to study two administrations of immunoglobulins and two doses, showed that both doses of SCIg IgPro20 were efficacious and well tolerated, suggesting that SCIg can be used as a maintenance treatment for CIDP. CSL Behring.",https://pubmed.ncbi.nlm.nih.gov/29122523/,Jan-18,CSL Behring
64,PUBMED,"Human Lung Organoids-A Novel Experimental and Precision Medicine Approach. The global burden of respiratory diseases is very high and still on the rise, prompting the need for accurate models for basic and translational research. Several model systems are currently available ranging from simple airway cell cultures to complex tissue-engineered lungs. In recent years, human lung organoids have been established as highly transferrable three-dimensional in vitro model systems for lung research. For acute infectious and chronic inflammatory diseases as well as lung cancer, human lung organoids have opened possibilities for precise in vitro research and a deeper understanding of mechanisms underlying lung injury and regeneration. Human lung organoids from induced pluripotent stem cells or from adult stem cells of patients' samples introduce tools for understanding developmental processes and personalized medicine approaches. When further state-of-the-art technologies and protocols come into use, the full potential of human lung organoids can be harnessed. High-throughput assays in drug development, gene therapy, and organoid transplantation are current applications of organoids in translational research. In this review, we emphasize novel approaches in translational and personalized medicine in lung research focusing on the use of human lung organoids.",https://pubmed.ncbi.nlm.nih.gov/37626876/,Aug-23,CSL Behring
65,PUBMED,"Apolipoprotein A1 Infusions and Cardiovascular Outcomes after Acute Myocardial Infarction. Cardiovascular events frequently recur after acute myocardial infarction, and low cholesterol efflux - a process mediated by apolipoprotein A1, which is the main protein in high-density lipoprotein - has been associated with an increased risk of cardiovascular events. CSL112 is human apolipoprotein A1 derived from plasma that increases cholesterol efflux capacity. Whether infusions of CSL112 can reduce the risk of recurrent cardiovascular events after acute myocardial infarction is unclear. We conducted an international, double-blind, placebo-controlled trial involving patients with acute myocardial infarction, multivessel coronary artery disease, and additional cardiovascular risk factors. Patients were randomly assigned to receive either four weekly infusions of 6 g of CSL112 or matching placebo, with the first infusion administered within 5 days after the first medical contact for the acute myocardial infarction. The primary end point was a composite of myocardial infarction, stroke, or death from cardiovascular causes from randomization through 90 days of follow-up. A total of 18,219 patients were included in the trial (9112 in the CSL112 group and 9107 in the placebo group). There was no significant difference between the groups in the risk of a primary end-point event at 90 days of follow-up (439 patients [4.8%] in the CSL112 group vs. 472 patients [5.2%] in the placebo group; hazard ratio, 0.93; 95% confidence interval [CI], 0.81 to 1.05; P = 0.24), at 180 days of follow-up (622 patients [6.9%] vs. 683 patients [7.6%]; hazard ratio, 0.91; 95% CI, 0.81 to 1.01), or at 365 days of follow-up (885 patients [9.8%] vs. 944 patients [10.5%]; hazard ratio, 0.93; 95% CI, 0.85 to 1.02). The percentage of patients with adverse events was similar in the two groups; a higher number of hypersensitivity events was reported in the CSL112 group. Among patients with acute myocardial infarction, multivessel coronary artery disease, and additional cardiovascular risk factors, four weekly infusions of CSL112 did not result in a lower risk of myocardial infarction, stroke, or death from cardiovascular causes than placebo through 90 days. (Funded by CSL Behring; AEGIS-II ClinicalTrials.gov number, NCT03473223.).",https://pubmed.ncbi.nlm.nih.gov/38587254/,May-24,CSL Behring
