source_id,source_type,raw_text,source_url,date,company_seed
21,SEC,"PFIZER INC 10-K Extracted item 1A ITEM 1A. RISK FACTORS ##TABLE_END This section describes the material risks to our business, which should be considered carefully in addition to the other information in this report and our other filings with the SEC. Investors should be aware that it is not possible to predict or identify all such factors and that the following is not meant to be a complete discussion of all potential risks or uncertainties. Additionally, our business is subject to general risks applicable to any company, such as economic conditions, geopolitical events, extreme weather and natural disasters. If known or unknown risks or uncertainties materialize, our business operations, financial condition, operating results (including components of our financial results), cash flows, prospects, reputation or credit ratings could be materially adversely affected now and in the future. The following discussion of risk factors contains forward-looking statements, as discussed in the Forward-Looking Information and Factors that May Affect Future Results section. RISKS RELATED TO OUR BUSINESS, INDUSTRY AND OPERATIONS: MANAGED CARE TRENDS Private payors, such as health plans, and other managed care entities, such as PBMs, continue to take action to manage the utilization and costs of drugs in the U.S., the single largest market for biopharmaceutical products. The negotiating power of MCOs, PBMs and other private third-party payors has increased due to consolidation, and they, along with state and federal governments, increasingly employ tools to control costs and encourage utilization of certain drugs, including through the use of deductibles, utilization management tools, cost sharing or formulary placement. They may demand rebates and/or fees from biopharmaceutical manufacturers for preferred formulary placement, or for unrestricted access on a drug formulary. The growing availability and use of higher-cost innovative specialty pharmaceutical medicines that treat rare life-threatening conditions has also increased payor interest in the deployment of cost-containment strategies. We may fail to obtain or maintain timely or adequate pricing or formulary placement of our products, or fail to obtain such formulary placement at pricing that reflects the value of the treatment. Some payers are directing beneficiaries to third-party patient assistance programs, rather than covering certain treatments. In other instances, insurers disallow manufacturers&#8217; co-pay assistance from counting toward reaching the deductible or out-of-pocket maximum. Both approaches can delay access to treatment or result in treatment abandonment. Further, consumers are facing responsibility for a larger portion of their prescription costs, or administrative hurdles to access, and may favor lower-cost, or generic alternatives, or seek direct-to-consumer medications outside of insurance plans. Third-party payors also use additional measures such as new-to-market blocks, exclusion lists, carve-outs or indication-based pricing and value-based pricing/contracting to improve their cost containment efforts and cost efficiency. Such payors are also increasingly imposing utilization management tools requiring prior authorization for a branded product or requiring the patient to first fail on one or more other products before permitting access to a particular branded medicine. As the U.S. third-party payor market consolidates further, and as the IRA prices become publicly available, we may face greater pricing pressure from third-party payors, including insurers and PBMs, as they continue to drive more of their patients to use lower cost alternatives or seek even larger rebates to control costs or offset losses from the IRA and other market pressures. For additional information on the IRA see the Item 1. Business &#8211;&#8211; Pricing Pressures and Managed Care Organizations and &#8211;&#8211;Government Regulation and Price Constraints and Item 1A. Risk Factors &#8211;&#8211; Pricing and Reimbursement sections. Also, business arrangements in this area are subject to a high degree of government scrutiny, and available exceptions and safe harbors under applicable federal and state fraud and abuse laws are subject to change through legislative and regulatory action, as well as evolving judicial interpretations. Our approach to these arrangements may also be informed by such government and industry guidance. COMPETITIVE PRODUCTS Competitive product launches have and may erode future sales of our products, including our existing products and those currently under development, or result in product obsolescence. Such launches continue to occur, and potentially competitive products are in various stages of development. We cannot predict with accuracy the timing or impact of the introduction of competitive products that treat or prevent diseases and conditions like those treated or prevented by our in-line products and product candidates. In addition to the impact of competitive product launches, we are facing an increasing number of potential competitors worldwide, including from China, that have expanded R&#38;D capabilities. Some of our competitors may have competitive, technical or other advantages over us for the development of technologies and processes or greater experience in particular therapeutic areas, and technological innovation and/or consolidation among certain pharmaceutical and biotechnology companies can enhance such advantages. These advantages may make it difficult for us to compete with them successfully to discover, develop and market new products and for our current products to compete with new products or indications they may bring to market. Our products and product candidates compete, and may compete in the future, against products or product candidates that offer higher rebates or discounts, exclusionary contracting, lower prices, equivalent or superior efficacy and/or coverage, better safety or tolerability profiles, easier administration, earlier market availability or other competitive features, including greater brand recognition or potential preference to prescribe existing competitor treatments over our novel therapies. For example, with the growing competition in the vaccine space, we are subject to increasing discounts to meet competitive dynamics and to help ensure our vaccines are available in retail pharmacies. If we are unable to compete effectively, this could reduce actual or anticipated future sales, which could negatively impact our results of operations. Several manufacturers, including Pfizer, have signed voluntary agreements with the Trump Administration designed to ensure U.S. patients pay lower prices for their prescription medicines. This may impact the competitive environment, including pricing dynamics for any of our current or potential future products, as well as contracting with payers. In addition, competition from manufacturers of generic drugs, including from generic versions of competitors&#8217; branded products that lose their market exclusivity, is a major challenge for our branded products. Certain of our products have experienced significant generic competition over the last few years. We anticipate a significant reduction of revenue from patent-based or regulatory exclusivity expiries in 2026 through 2030 as several of our in-line products experience these expirations, with the rate of the reduction of revenues from patent-based or regulatory exclusivity expiries expected to significantly accelerate over the next few years. See the Item 1. Business&#8212;Patents and Other Intellectual Property Rights ##TABLE_START Pfizer Inc. 2025 Form 10-K ##TABLE_END section. In China, we expect to continue to face intense competition by certain generic manufacturers, which has resulted, and may result in the future, in price cuts and volume loss of some of our products. In addition, our patented products may face generic or biosimilar competition before patent-based and/or regulatory exclusivity expires, including from &#8220;at-risk&#8221; launch (despite pending patent infringement litigation against the generic or biosimilar product) by a manufacturer of a generic or biosimilar version of one of our patented products. Generic and biosimilar manufacturers have filed or could file applications with the FDA seeking approval of product candidates that they claim do not infringe our or our collaboration and licensing partners&#8217; patents or claim that our or our collaboration and licensing partners&#8217; patents are not valid. We and our licensing and collaboration partners also face challenges in various jurisdictions by generic drug manufacturers to patents covering products for which we have patent rights, licenses or co-promotion rights. See Note 16A1 . We may become subject to competition from biosimilars referencing our biologic products if competitors are able to obtain marketing approval for such biosimilars. We also commercialize biosimilar products that compete with products of others, including other biosimilar products. The number of current and forthcoming competing biosimilars, coupled with Medicare&#8217;s average sales price-based provider reimbursement methodology, is expected to increase pricing pressures on our biosimilar products. Uptake of our biosimilars may be lower due to various factors, such as access challenges where our product may not receive appropriate coverage/reimbursement access or remains in a disadvantaged position relative to an innovator product. For additional information on competition our products face, see the Item 1. Business &#8212; Competition section. CONCENTRATION We recorded revenues of more than $1 billion for each of 12 products that collectively accounted for 65% of Total revenues in 2025. For example, Eliquis accounted for 13% of Total revenues in 2025. See N otes 1 and 17 . If these products or any of our other major products were to, or continue to (if applicable), experience loss of patent protection (if applicable), changes in prescription or vaccination purchasing or growth rates, reduced product demand, material product liability litigation, unexpected side effects or safety concerns, regulatory proceedings or investigations, lower governmental and/or regulatory confidence, negative publicity affecting doctor or patient confidence, pressure from competitive products, changes in recommendations and coverage, changes in labeling, pricing and access pressures, including those related to the IRA and MFN, or supply shortages or if a new, more effective product should be introduced, the adverse impact on our revenues could be significant and our revenue forecasts and expectations could prove to be inaccurate and we may fail to meet these expectations. In particular, certain of our products have experienced patent-based expirations or loss of regulatory exclusivity in certain markets in the last few years, and we expect certain products to face new or increased generic competition over the next few years. We anticipate a significant reduction of revenue from patent-based or regulatory exclusivity expiries in 2026 through 2030 as several of our in-line products experience these expirations. In addition, patents covering a number of our best-selling products are, or have been, the subject of pending legal challenges. For additional information on our patents, see the Item 1. Business &#8212; Patents and Other Intellectual Property Rights section. Furthermore, our recent business development initiatives have been concentrated in certain therapeutic areas &#8212; for example, our acquisitions of Metsera and Seagen represent significant investments in obesity and oncology, respectively, which are extremely competitive therapeutic areas. In addition, revenues from Comirnaty and Paxlovid have decreased substantially over time and could continue to decrease. For Paxlovid, utilization is expected to follow infection trends",https://www.sec.gov/Archives/edgar/data/78003/000007800326000026/pfe-20251231.htm,Feb-26,Pfizer
22,SEC,"PFIZER INC 8-K pfe-20260203 0000078003 false 0000078003 2026-02-03 2026-02-03 0000078003 us-gaap:CommonStockMember 2026-02-03 2026-02-03 0000078003 pfe:NotesDue20271.000Member 2026-02-03 2026-02-03 0000078003 pfe:NotesDue20292.875Member 2026-02-03 2026-02-03 0000078003 pfe:NotesDue20323.250Member 2026-02-03 2026-02-03 0000078003 pfe:NotesDue20373.875Member 2026-02-03 2026-02-03 0000078003 pfe:NotesDue20454.250Member 2026-02-03 2026-02-03 UNITED STATES SECURITIES AND EXCHANGE COMMISSION Washington, D.C. 20549 FORM 8-K CURRENT REPORT PURSUANT TO SECTION 13 OR 15(d) OF THE SECURITIES EXCHANGE ACT OF 1934 Date of Report (Date of earliest event reported): February 3, 2026 PFIZER INC . (Exact name of registrant as specified in its charter) Delaware 1-3619 13-5315170 (State or other (Commission File (I.R.S. Employer jurisdiction of Number) Identification No.) incorporation) 66 Hudson Boulevard East 10001-2192 New York, New York (Zip Code) (Address of principal executive offices) Registrant’s telephone number, including area code: ( 212 ) 733-2323 (Former name or former address, if changed since last report) Check the appropriate box below if the Form 8-K filing is intended to simultaneously satisfy the filing obligation of the registrant under any of the following provisions (see General Instruction A.2. below): ☐ Written communications pursuant to Rule 425 under the Securities Act (17 CFR 230.425) ☐ Soliciting material pursuant to Rule 14a-12 under the Exchange Act (17 CFR 240.14a-12) ☐ Pre-commencement communications pursuant to Rule 14d-2(b) under the Exchange Act (17 CFR 240.14d-2 (b)) ☐ Pre-commencement communications pursuant to Rule 13e-4(c) under the Exchange Act (17 CFR 240.13e-4(c)) Securities registered pursuant to Section 12(b) of the Act: Title of each class Trading Symbol(s) Name of each exchange on which registered Common Stock, $0.05 par value PFE New York Stock Exchange 1.000% Notes due 2027 PFE/27 New York Stock Exchange 2.875% Notes due 2029 PFE/29 New York Stock Exchange 3.250% Notes due 2032 PFE/32 New York Stock Exchange 3.875% Notes due 2037 PFE/37A New York Stock Exchange 4.250% Notes due 2045 PFE/45 New York Stock Exchange Indicate by check mark whether the registrant is an emerging growth company as defined in Rule 405 of the Securities Act of 1933 (§230.405 of this chapter) or Rule 12b-2 of the Securities Exchange Act of 1934 (§240.12b-2 of this chapter). Emerging growth company ☐ If an emerging growth company, indicate by check mark if the registrant has elected not to use the extended transition period for complying with any new or revised financial accounting standards provided pursuant to Section 13(a) of the Exchange Act. ☐ Item 2.02 Results of Operations and Financial Condition On February 3, 2026, Pfizer Inc. (“Pfizer”) issued a press release announcing its financial results for the fourth quarter of 2025. A copy of the press release is furnished herewith as Exhibit 99 and is incorporated by reference herein. The information furnished pursuant to this “Item 2.02 - Results of Operations and Financial Condition”, including Exhibit 99, shall not be deemed to be “filed” for the purposes of Section 18 of the Securities Exchange Act of 1934, as amended (the “Exchange Act”) or otherwise subject to the liabilities of that section, and shall not be deemed to be incorporated by reference into any filing made by us under the Exchange Act or Securities Act of 1933, as amended, regardless of any general incorporation language in any such filing, except as shall be expressly set forth by specific reference in such filing. Item 9.01 Financial Statements and Exhibits (d) Exhibits Exhibit Number Exhibit Description Exhibit 99 Press Release of Pfizer Inc. dated February 3, 2026 , reporting Pfizer’s financial results for the fourth quarter of 2025. 104 Cover Page Interactive Data File--the cover page XBRL tags are embedded within the Inline XBRL document. EXHIBIT INDEX Exhibit No. Description 99 Press Release of Pfizer Inc. dated February 3, 2026, reporting Pfizer’s financial results for the fourth quarter of 2025. 104 Cover Page Interactive Data File--the cover page XBRL tags are embedded within the Inline XBRL document. SIGNATURES Pursuant to the requirements of the Securities Exchange Act of 1934, the registrant has duly caused this report to be signed on its behalf by the undersigned hereunto duly authorized. PFIZER INC. By: /s/ Margaret M. Madden Margaret M. Madden Senior Vice President and Corporate Secretary Chief Governance Counsel Dated: February 3, 2026",https://www.sec.gov/Archives/edgar/data/78003/000007800326000005/pfe-20260203.htm,Feb-26,Pfizer
23,SEC,"PFIZER INC 8-K pfe-20251216 0000078003 false 0000078003 2025-12-16 2025-12-16 0000078003 us-gaap:CommonStockMember 2025-12-16 2025-12-16 0000078003 pfe:NotesDue20271.000Member 2025-12-16 2025-12-16 0000078003 pfe:NoteDue20292.875Member 2025-12-16 2025-12-16 0000078003 pfe:NoteDue20323.250Member 2025-12-16 2025-12-16 0000078003 pfe:NoteDue20373.875Member 2025-12-16 2025-12-16 0000078003 pfe:NoteDue20454.250Member 2025-12-16 2025-12-16 UNITED STATES SECURITIES AND EXCHANGE COMMISSION Washington, D.C. 20549 FORM 8-K CURRENT REPORT PURSUANT TO SECTION 13 OR 15(d) OF THE SECURITIES EXCHANGE ACT OF 1934 Date of Report (Date of earliest event reported): December 16, 2025 PFIZER INC . (Exact name of registrant as specified in its charter) Delaware 1-3619 13-5315170 (State or other (Commission File (I.R.S. Employer jurisdiction of Number) Identification No.) incorporation) 66 Hudson Boulevard East 10001-2192 New York, New York (Zip Code) (Address of principal executive offices) Registrant’s telephone number, including area code: ( 212 ) 733-2323 (Former name or former address, if changed since last report) Check the appropriate box below if the Form 8-K filing is intended to simultaneously satisfy the filing obligation of the registrant under any of the following provisions (see General Instruction A.2. below): ☐ Written communications pursuant to Rule 425 under the Securities Act (17 CFR 230.425) ☐ Soliciting material pursuant to Rule 14a-12 under the Exchange Act (17 CFR 240.14a-12) ☐ Pre-commencement communications pursuant to Rule 14d-2(b) under the Exchange Act (17 CFR 240.14d-2 (b)) ☐ Pre-commencement communications pursuant to Rule 13e-4(c) under the Exchange Act (17 CFR 240.13e-4(c)) Securities registered pursuant to Section 12(b) of the Act: Title of each class Trading Symbol(s) Name of each exchange on which registered Common Stock, $0.05 par value PFE New York Stock Exchange 1.000% Notes due 2027 PFE/27 New York Stock Exchange 2.875% Notes due 2029 PFE/29 New York Stock Exchange 3.250% Notes due 2032 PFE/32 New York Stock Exchange 3.875% Notes due 2037 PFE/37A New York Stock Exchange 4.250% Notes due 2045 PFE/45 New York Stock Exchange Indicate by check mark whether the registrant is an emerging growth company as defined in Rule 405 of the Securities Act of 1933 (§230.405 of this chapter) or Rule 12b-2 of the Securities Exchange Act of 1934 (§240.12b-2 of this chapter). Emerging growth company ☐ If an emerging growth company, indicate by check mark if the registrant has elected not to use the extended transition period for complying with any new or revised financial accounting standards provided pursuant to Section 13(a) of the Exchange Act. ☐ Item 7.01. Regulation FD Disclosure. On December 16, 2025, Pfizer Inc. issued a press release that provided its full-year 2026 guidance and revised its full-year 2025 Revenue guidance while reaffirming all other components of its full-year 2025 financial guidance. A copy of the press release is furnished as Exhibit 99.1 hereto and is incorporated herein by reference. The information furnished pursuant to this “Item 7.01 – Regulation FD Disclosure”, including Exhibit 99.1, shall not be deemed to be “filed” for the purposes of Section 18 of the Exchange Act or otherwise subject to the liabilities of that section, and shall not be deemed to be incorporated by reference into any filing made by us under the Exchange Act or the Securities Act, regardless of any general incorporation language in any such filing, except as shall be expressly set forth by specific reference in such filing. Item 9.01. Financial Statements and Exhibits. (d) Exhibits Exhibit No. Exhibit Description Exhibit 99.1 Press Release of Pfizer Inc. dated December 16, 2025 104 Cover Page Interactive Data File--the cover page XBRL tags are embedded within the Inline XBRL document. SIGNATURES Pursuant to the requirements of the Securities Exchange Act of 1934, the registrant has duly caused this report to be signed on its behalf by the undersigned hereunto duly authorized. PFIZER INC. By: /s/ Margaret M. Madden Margaret M. Madden Senior Vice President and Corporate Secretary Chief Governance Counsel Dated: December 16, 2025",https://www.sec.gov/Archives/edgar/data/78003/000007800325000167/pfe-20251216.htm,Dec-25,Pfizer
